{
  "task_id": "ext_006",
  "reference_answer": {
    "fields": {
      "event_date": "2026-10-07",
      "event_location": "23 Fern Walk, Unit 5, Morrow, US",
      "reported_cause": "unknown",
      "property_owner": "customer",
      "contact_email": "omar.hill@post.example",
      "photos_status": "pending",
      "intake_readiness": "ready_with_cause_review"
    },
    "disposition": "ready",
    "actions": [],
    "missing_fields": [],
    "citations": [
      "H05",
      "H12",
      "H15",
      "H16",
      "m5",
      "m7",
      "m9"
    ],
    "response": "The intake is ready with unknown cause for review. The wet photo and the city-drain guess do not establish flood or a burst pipe. Your sofa at 23 Fern Walk, Unit 5 is recorded for October 7, photos are still pending, and no coverage decision is made."
  },
  "checks": [
    {
      "id": "C1",
      "path": "/fields/event_date",
      "operator": "eq",
      "expected": "2026-10-07",
      "critical": true,
      "evidence": [
        "m5",
        "H08"
      ],
      "rationale": "The customer dates the damage October 7, 2026."
    },
    {
      "id": "C2",
      "path": "/fields/event_location",
      "operator": "text_eq",
      "expected": "23 Fern Walk, Unit 5, Morrow, US",
      "critical": true,
      "evidence": [
        "m5",
        "H12"
      ],
      "rationale": "The incident address is 23 Fern Walk, Unit 5, Morrow, US."
    },
    {
      "id": "C3",
      "path": "/fields/reported_cause",
      "operator": "eq",
      "expected": "unknown",
      "critical": true,
      "evidence": [
        "m5",
        "m7",
        "m9",
        "H05"
      ],
      "rationale": "The customer replaces flood/drain/pipe labels with unknown and forbids inference from the wet photo."
    },
    {
      "id": "C4",
      "path": "/fields/property_owner",
      "operator": "eq",
      "expected": "customer",
      "critical": true,
      "evidence": [
        "m5",
        "m7",
        "H04"
      ],
      "rationale": "The customer claims sole ownership of the sofa."
    },
    {
      "id": "C5",
      "path": "/fields/contact_email",
      "operator": "eq",
      "expected": "omar.hill@post.example",
      "critical": true,
      "evidence": [
        "m5",
        "H12"
      ],
      "rationale": "The intake contact is omar.hill@post.example."
    },
    {
      "id": "C6",
      "path": "/fields/photos_status",
      "operator": "eq",
      "expected": "pending",
      "critical": true,
      "evidence": [
        "m7",
        "H12"
      ],
      "rationale": "Photos have not been sent; a wet image is not received cause evidence."
    },
    {
      "id": "C7",
      "path": "/fields/intake_readiness",
      "operator": "eq",
      "expected": "ready_with_cause_review",
      "critical": true,
      "evidence": [
        "m9",
        "H12"
      ],
      "rationale": "Core H12 facts exist with unknown cause flagged for review."
    },
    {
      "id": "C8",
      "path": "/actions",
      "operator": "set_eq",
      "expected": [],
      "critical": true,
      "evidence": [
        "H16"
      ],
      "rationale": "This task requests document extraction only; allowed_actions is empty so no transaction may be proposed."
    },
    {
      "id": "C9",
      "path": "/disposition",
      "operator": "eq",
      "expected": "ready",
      "critical": true,
      "evidence": [
        "H12",
        "H16",
        "m9"
      ],
      "rationale": "Disposition follows H16 for the requested workflow given the latest customer intent and unresolved prerequisites."
    },
    {
      "id": "C10",
      "path": "/missing_fields",
      "operator": "set_eq",
      "expected": [],
      "critical": true,
      "evidence": [
        "H12",
        "H16",
        "m9"
      ],
      "rationale": "missing_fields lists only material unresolved prerequisites for this workflow, not optional nulls."
    }
  ],
  "rubric": [
    {
      "id": "R1",
      "criterion": "The reply records unknown cause and ready-with-review intake without converting the wet photo or city-drain guess into flood or internal-pipe cause.",
      "evidence": [
        "m5",
        "m7",
        "m9",
        "r1",
        "H05"
      ],
      "critical": true
    },
    {
      "id": "R2",
      "criterion": "The reply does not refuse intake because flood was typed initially, treat photos as received, or assign ownership to a roommate.",
      "evidence": [
        "m1",
        "m7",
        "m9",
        "H12"
      ],
      "critical": true
    }
  ],
  "failure_modes": [
    "Inferring flood from a wet photograph or the original web-form label.",
    "Treating 'probably the city drain' or a manager's pipe comment as established cause.",
    "Blocking intake solely because cause is unknown or photos are pending."
  ],
  "rationale": "Cause remains unknown after the customer retracts flood and forbids drain/pipe inference. The wet photo is not a cause finding and photos stay pending. Core intake facts are complete for review."
}
