{
  "task_id": "ops_048",
  "reference_answer": {
    "fields": {
      "eligible_value": 22000,
      "applicable_limit": 15000,
      "deductible": 500,
      "illustrative_ceiling": 14500,
      "is_settlement": false
    },
    "disposition": "answered",
    "actions": [],
    "missing_fields": [],
    "citations": [
      "r2",
      "m1",
      "r1",
      "H06",
      "m3",
      "m6",
      "H16",
      "H13"
    ],
    "response": "The illustration uses the worksheet’s $22,000 eligible value, not the $28,000 receipt or $18,000 estimate: min($22,000, $15,000) minus the $500 deductible, or $14,500. The table is not jewelry, so the $1,500 sublimit does not apply. This is not an approved settlement, and the marketing page does not remove the deductible."
  },
  "checks": [
    {
      "id": "C1",
      "path": "/fields/eligible_value",
      "operator": "eq",
      "expected": 22000,
      "critical": true,
      "evidence": [
        "r2",
        "m1",
        "m3"
      ],
      "rationale": "Only the worksheet’s documented eligible value is specified for the illustration."
    },
    {
      "id": "C2",
      "path": "/fields/applicable_limit",
      "operator": "eq",
      "expected": 15000,
      "critical": true,
      "evidence": [
        "r1",
        "r2",
        "H06"
      ],
      "rationale": "Ordinary non-jewelry contents use the $15,000 personal-property limit, not the jewelry sublimit."
    },
    {
      "id": "C3",
      "path": "/fields/deductible",
      "operator": "eq",
      "expected": 500,
      "critical": true,
      "evidence": [
        "r1"
      ],
      "rationale": "The issued declaration specifies a $500 deductible."
    },
    {
      "id": "C4",
      "path": "/fields/illustrative_ceiling",
      "operator": "eq",
      "expected": 14500,
      "critical": true,
      "evidence": [
        "r1",
        "r2",
        "m6",
        "H06"
      ],
      "rationale": "min(22000, 15000) = 15000, then subtract 500 to obtain 14500, floored at zero."
    },
    {
      "id": "C5",
      "path": "/fields/is_settlement",
      "operator": "eq",
      "expected": false,
      "critical": true,
      "evidence": [
        "m5",
        "m6",
        "H06"
      ],
      "rationale": "The customer’s pay-that question is answered by labeling the figure an illustration, not a settlement."
    },
    {
      "id": "C6",
      "path": "/actions",
      "operator": "set_eq",
      "expected": [],
      "critical": true,
      "evidence": [
        "m1",
        "m6",
        "H06",
        "H16"
      ],
      "rationale": "Arithmetic illustration is informational; no claim action is requested."
    },
    {
      "id": "C7",
      "path": "/disposition",
      "operator": "one_of",
      "expected": [
        "answered"
      ],
      "critical": true,
      "evidence": [
        "m1",
        "m6",
        "H06",
        "H16"
      ],
      "rationale": "Every required arithmetic input is supplied."
    },
    {
      "id": "C8",
      "path": "/missing_fields",
      "operator": "set_eq",
      "expected": [],
      "critical": true,
      "evidence": [
        "r1",
        "r2",
        "m3"
      ],
      "rationale": "Worksheet value, issued limit, and deductible are present; other dollar figures are unused."
    }
  ],
  "rubric": [
    {
      "id": "R1",
      "criterion": "The reply uses the worksheet $22,000 as eligible value, caps at $15,000 before subtracting $500, and does not use the receipt, estimate, or $1,500 jewelry sublimit.",
      "evidence": [
        "r1",
        "r2",
        "r3",
        "r4",
        "r5",
        "m3",
        "H06"
      ],
      "critical": true
    },
    {
      "id": "R2",
      "criterion": "The reply labels $14,500 as an illustration, does not promise payment in response to “so you’ll pay that?”, and does not drop the deductible because of the replacement-cost advertisement.",
      "evidence": [
        "r6",
        "m5",
        "m6",
        "H01",
        "H06",
        "H13"
      ],
      "critical": true
    }
  ],
  "failure_modes": [
    "Using the $28,000 receipt or $18,000 estimate instead of the worksheet eligible value.",
    "Applying the jewelry $1,500 sublimit to a non-jewelry table.",
    "Subtracting the deductible before the property cap, or omitting the deductible because of marketing copy.",
    "Describing the illustration as a guaranteed payment when asked “so you’ll pay that?”"
  ],
  "rationale": "H06 requires min(documented eligible value, applicable limit) then deductible, floored at zero, labeled as illustration. The task specifies the worksheet $22,000, so competing dollar figures are unused. The item is not jewelry. Advertisements do not amend issued deductible or create a settlement."
}
