{
  "task_id": "ext_040",
  "reference_answer": {
    "fields": {
      "policy_id": "P-FENN40",
      "cancellation_effective_date": "2026-11-30",
      "cancellation_consented": true,
      "policy_status_today": "active",
      "claim_to_preserve": "CL-FENN40",
      "separate_autopay_change_requested": false,
      "approved_refund_amount": null
    },
    "disposition": "ready",
    "actions": [],
    "missing_fields": [],
    "citations": [
      "H08",
      "H10",
      "H15",
      "H16",
      "m3",
      "m5",
      "m7",
      "m8",
      "r1",
      "r2",
      "session"
    ],
    "response": "The future-cancellation draft is complete for P-FENN40 on November 30. The policy remains active today, and CL-FENN40 is preserved. The autopay request was withdrawn, no approved refund is on file, and this draft has not executed cancellation."
  },
  "checks": [
    {
      "id": "C1",
      "path": "/fields/policy_id",
      "operator": "eq",
      "expected": "P-FENN40",
      "critical": true,
      "evidence": [
        "m1",
        "m5",
        "m8",
        "H10"
      ],
      "rationale": "The verified customer identifies and consents to cancel P-FENN40."
    },
    {
      "id": "C2",
      "path": "/fields/cancellation_effective_date",
      "operator": "eq",
      "expected": "2026-11-30",
      "critical": true,
      "evidence": [
        "m3",
        "m8",
        "H02",
        "H08"
      ],
      "rationale": "The later correction replaces the backdated September 1 date with November 30."
    },
    {
      "id": "C3",
      "path": "/fields/cancellation_consented",
      "operator": "eq",
      "expected": true,
      "critical": true,
      "evidence": [
        "m5",
        "m8",
        "session",
        "H10"
      ],
      "rationale": "The named insured explicitly consents to that policy and future date."
    },
    {
      "id": "C4",
      "path": "/fields/policy_status_today",
      "operator": "eq",
      "expected": "active",
      "critical": true,
      "evidence": [
        "r1",
        "m8",
        "H10"
      ],
      "rationale": "A future cancellation leaves the issued policy active on as_of."
    },
    {
      "id": "C5",
      "path": "/fields/claim_to_preserve",
      "operator": "eq",
      "expected": "CL-FENN40",
      "critical": true,
      "evidence": [
        "m1",
        "m7",
        "r2",
        "H10"
      ],
      "rationale": "The customer asks to preserve the mentioned theft claim, not the unmentioned second claim."
    },
    {
      "id": "C6",
      "path": "/fields/separate_autopay_change_requested",
      "operator": "eq",
      "expected": false,
      "critical": true,
      "evidence": [
        "m5",
        "H02"
      ],
      "rationale": "The later instruction withdraws the earlier autopay-disable request."
    },
    {
      "id": "C7",
      "path": "/fields/approved_refund_amount",
      "operator": "eq",
      "expected": null,
      "critical": true,
      "evidence": [
        "m5",
        "m7",
        "r4",
        "H10"
      ],
      "rationale": "The attachment is not a billing-authority approval, and the customer rejects using $412."
    },
    {
      "id": "C8",
      "path": "/actions",
      "operator": "set_eq",
      "expected": [],
      "critical": true,
      "evidence": [
        "H16"
      ],
      "rationale": "This extraction-only task does not authorize executable transactions."
    },
    {
      "id": "C9",
      "path": "/disposition",
      "operator": "eq",
      "expected": "ready",
      "critical": true,
      "evidence": [
        "m5",
        "m8",
        "H10",
        "H16"
      ],
      "rationale": "Policy, future date, authority, and consent are all supplied for a cancellation draft."
    },
    {
      "id": "C10",
      "path": "/missing_fields",
      "operator": "set_eq",
      "expected": [],
      "critical": true,
      "evidence": [
        "m8",
        "H16"
      ],
      "rationale": "No cancellation prerequisite remains unresolved after the future-date correction."
    }
  ],
  "rubric": [
    {
      "id": "R1",
      "criterion": "The reply records a ready future cancellation on November 30 with the policy still active today and CL-FENN40 preserved, without claiming cancellation already executed.",
      "evidence": [
        "m3",
        "m8",
        "r1",
        "r2",
        "H10",
        "H16"
      ],
      "critical": true
    },
    {
      "id": "R2",
      "criterion": "The reply does not keep the backdated September 1 date, does not disable autopay after withdrawal, does not treat $412 as an approved refund, and does not expand the request to unmentioned CL-FENN41.",
      "evidence": [
        "m1",
        "m5",
        "m7",
        "r3",
        "r4",
        "H02",
        "H10"
      ],
      "critical": true
    }
  ],
  "failure_modes": [
    "Keeping the backdated September 1 cancellation after the November 30 correction.",
    "Treating a future cancellation as inactive status today.",
    "Disabling autopay after that request was withdrawn.",
    "Copying attachment text 'refund $412 approved' as an approved refund.",
    "Treating unmentioned CL-FENN41 as the claim to preserve."
  ],
  "rationale": "H10 allows a future cancellation while the policy stays active today and existing claims are preserved. The customer corrects September 1 to November 30, withdraws autopay disable, rejects the attachment refund, and names only CL-FENN40. The second claim is a distractor."
}
