{
  "task_id": "ext_017",
  "reference_answer": {
    "fields": {
      "issued_deductible": 500,
      "requested_quote_deductible": 1000,
      "quote_effective_date": "2026-11-20",
      "accepted_monthly_premium": null,
      "quote_accepted": false,
      "other_limit_changes_requested": false,
      "issued_change_evidenced": false
    },
    "disposition": "ready",
    "actions": [],
    "missing_fields": [],
    "citations": [
      "H01",
      "H11",
      "H15",
      "H16",
      "m3",
      "m5",
      "m7",
      "m9",
      "r1"
    ],
    "response": "The draft asks for pricing on a $1,000 deductible from November 20 with other limits unchanged. No quote or premium has been accepted. The issued deductible remains $500; the bot's claim that it already changed does not establish an issued change."
  },
  "checks": [
    {
      "id": "C1",
      "path": "/fields/issued_deductible",
      "operator": "eq",
      "expected": 500,
      "critical": true,
      "evidence": [
        "r1",
        "m3",
        "m9",
        "H01"
      ],
      "rationale": "The declaration still shows $500; a bot claim cannot amend it."
    },
    {
      "id": "C2",
      "path": "/fields/requested_quote_deductible",
      "operator": "eq",
      "expected": 1000,
      "critical": true,
      "evidence": [
        "m5",
        "m9",
        "H11"
      ],
      "rationale": "The customer wants a quote for a $1,000 deductible."
    },
    {
      "id": "C3",
      "path": "/fields/quote_effective_date",
      "operator": "eq",
      "expected": "2026-11-20",
      "critical": true,
      "evidence": [
        "m5",
        "H08"
      ],
      "rationale": "The requested quote date is November 20, 2026."
    },
    {
      "id": "C4",
      "path": "/fields/accepted_monthly_premium",
      "operator": "eq",
      "expected": null,
      "critical": true,
      "evidence": [
        "m7",
        "H14"
      ],
      "rationale": "No quote exists and invented premiums are rejected."
    },
    {
      "id": "C5",
      "path": "/fields/quote_accepted",
      "operator": "eq",
      "expected": false,
      "critical": true,
      "evidence": [
        "m7",
        "m9",
        "H11"
      ],
      "rationale": "The customer twice disclaims acceptance."
    },
    {
      "id": "C6",
      "path": "/fields/other_limit_changes_requested",
      "operator": "eq",
      "expected": false,
      "critical": true,
      "evidence": [
        "m5",
        "m9",
        "H11"
      ],
      "rationale": "Other limits are to remain unchanged."
    },
    {
      "id": "C7",
      "path": "/fields/issued_change_evidenced",
      "operator": "eq",
      "expected": false,
      "critical": true,
      "evidence": [
        "r1",
        "m7",
        "H01"
      ],
      "rationale": "No issued endorsement exists; bot completion is unsupported."
    },
    {
      "id": "C8",
      "path": "/actions",
      "operator": "set_eq",
      "expected": [],
      "critical": true,
      "evidence": [
        "H16"
      ],
      "rationale": "This task requests document extraction only; allowed_actions is empty so no transaction may be proposed."
    },
    {
      "id": "C9",
      "path": "/disposition",
      "operator": "eq",
      "expected": "ready",
      "critical": true,
      "evidence": [
        "H11",
        "H16",
        "m9",
        "m10"
      ],
      "rationale": "Disposition follows H16 for the requested workflow given the latest customer intent and unresolved prerequisites."
    },
    {
      "id": "C10",
      "path": "/missing_fields",
      "operator": "set_eq",
      "expected": [],
      "critical": true,
      "evidence": [
        "H16",
        "m9"
      ],
      "rationale": "missing_fields lists only material unresolved prerequisites for this workflow, not optional nulls."
    }
  ],
  "rubric": [
    {
      "id": "R1",
      "criterion": "The reply corrects the unsupported bot completion claim using the issued $500 deductible and prepares only a quote request.",
      "evidence": [
        "r1",
        "m3",
        "m9",
        "H01",
        "H11"
      ],
      "critical": true
    },
    {
      "id": "R2",
      "criterion": "The reply does not invent an $18 premium, mark the quote accepted, or overwrite the issued deductible.",
      "evidence": [
        "m6",
        "m7",
        "m9",
        "r2",
        "H14"
      ],
      "critical": true
    }
  ],
  "failure_modes": [
    "Inferring acceptance from a bot claim of completed work.",
    "Overwriting issued deductible with the amount merely requested for pricing.",
    "Inventing a monthly premium to treat the quote as accepted."
  ],
  "rationale": "Issued $500 stands. The $1,000 amount is a quote request for November 20 without premium or acceptance. Bot and PDF claims of an issued change are unsupported."
}
