{
  "task_id": "ops_049",
  "reference_answer": {
    "fields": {
      "issued_property_limit": 15000,
      "historically_accepted_quote": "Q-49-A",
      "current_quote_id": "Q-49-B",
      "current_quote_accepted": false,
      "ready_to_issue_change": false
    },
    "disposition": "needs_clarification",
    "actions": [
      {
        "type": "request_quote_acceptance",
        "target": "r1",
        "value": {
          "quote_ref": "r3"
        }
      }
    ],
    "missing_fields": [
      "current_quote_accepted"
    ],
    "citations": [
      "r1",
      "H01",
      "m1",
      "m5",
      "m6",
      "r2",
      "r3",
      "H11",
      "H02",
      "H16"
    ],
    "response": "Your issued property limit remains $15,000; the bot message did not issue a change. Q-49-A was accepted at $18 but has been superseded. “The cheaper one” does not accept Q-49-B’s $31 from November 1. Please confirm whether you accept Q-49-B exactly. No issued change is proposed."
  },
  "checks": [
    {
      "id": "C1",
      "path": "/fields/issued_property_limit",
      "operator": "eq",
      "expected": 15000,
      "critical": true,
      "evidence": [
        "r1",
        "H01"
      ],
      "rationale": "Quotes and a bot claim of issuance do not replace supplied issued declarations."
    },
    {
      "id": "C2",
      "path": "/fields/historically_accepted_quote",
      "operator": "eq",
      "expected": "Q-49-A",
      "critical": true,
      "evidence": [
        "m1",
        "m5"
      ],
      "rationale": "The customer confirms historical acceptance only of the old $18 quote."
    },
    {
      "id": "C3",
      "path": "/fields/current_quote_id",
      "operator": "eq",
      "expected": "Q-49-B",
      "critical": true,
      "evidence": [
        "r2",
        "r3"
      ],
      "rationale": "The supplied record explicitly supersedes A with currently available B."
    },
    {
      "id": "C4",
      "path": "/fields/current_quote_accepted",
      "operator": "eq",
      "expected": false,
      "critical": true,
      "evidence": [
        "r3",
        "m3",
        "m5",
        "H11"
      ],
      "rationale": "Accepting the cheaper one does not name Q-49-B’s premium and date."
    },
    {
      "id": "C5",
      "path": "/fields/ready_to_issue_change",
      "operator": "eq",
      "expected": false,
      "critical": true,
      "evidence": [
        "r3",
        "m5",
        "H11"
      ],
      "rationale": "Issuance requires explicit acceptance of the exact current quote."
    },
    {
      "id": "C6",
      "path": "/actions",
      "operator": "set_eq",
      "expected": [
        {
          "type": "request_quote_acceptance",
          "target": "r1",
          "value": {
            "quote_ref": "r3"
          }
        }
      ],
      "critical": true,
      "evidence": [
        "r3",
        "m6",
        "H11",
        "H16"
      ],
      "rationale": "The customer authorized asking for current-quote acceptance and forbade applying the obsolete $18 quote."
    },
    {
      "id": "C7",
      "path": "/disposition",
      "operator": "one_of",
      "expected": [
        "needs_clarification"
      ],
      "critical": true,
      "evidence": [
        "m5",
        "H11",
        "H16"
      ],
      "rationale": "The missing prerequisite is acceptance of Q-49-B, not identity or a new quote request."
    },
    {
      "id": "C8",
      "path": "/missing_fields",
      "operator": "set_eq",
      "expected": [
        "current_quote_accepted"
      ],
      "critical": true,
      "evidence": [
        "r3",
        "m5",
        "H11"
      ],
      "rationale": "Exact current-quote acceptance remains unresolved."
    }
  ],
  "rubric": [
    {
      "id": "R1",
      "criterion": "The reply distinguishes historical acceptance of Q-49-A from missing acceptance of Q-49-B and does not treat “the cheaper one” as acceptance of the $31 quote.",
      "evidence": [
        "r2",
        "r3",
        "m1",
        "m3",
        "m5",
        "H11"
      ],
      "critical": true
    },
    {
      "id": "R2",
      "criterion": "The reply keeps the issued limit at $15,000, rejects the bot’s already-issued claim, asks for Q-49-B acceptance, and does not apply the superseded $18 quote.",
      "evidence": [
        "r1",
        "m2",
        "m6",
        "H01",
        "H02",
        "H11",
        "H16"
      ],
      "critical": true
    }
  ],
  "failure_modes": [
    "Treating “I accept the cheaper one” as acceptance of current quote Q-49-B.",
    "Believing the bot that the $30,000 limit is already issued.",
    "Applying superseded Q-49-A because limit and effective date stayed the same."
  ],
  "rationale": "H01 keeps issued limit at $15,000 despite the bot’s false completion claim. H11 requires acceptance of the exact current quote, date, and premium. Accepting “the cheaper one” points at superseded Q-49-A, which the customer still distinguishes from $31. The allowed next step is request_quote_acceptance for r3."
}
