{
  "task_id": "ext_048",
  "reference_answer": {
    "fields": {
      "applicant_name": "Freya Stone",
      "contact_email": "freya.stone@example.test",
      "insured_address": "39 Hazel Wharf, Unit 4, Silver Brook",
      "occupancy_start": "2026-10-31",
      "requested_start": "2026-10-29",
      "personal_property_limit": 50000,
      "liability_limit": 300000,
      "deductible": 250,
      "consent_to_submit": true,
      "other_occupants": [
        "Nia Cole"
      ]
    },
    "disposition": "ready",
    "actions": [],
    "missing_fields": [],
    "citations": [
      "H02",
      "H14",
      "H15",
      "H16",
      "m1",
      "m10",
      "m3",
      "m5",
      "m7",
      "m8",
      "r1"
    ],
    "response": "The draft is complete for applicant Freya Stone with occupancy October 31, an October 29 requested insurance start, and Nia Cole listed only as another occupant. Nia is not a co-applicant, her September 28 box drop-off is not occupancy, and the leftover draft that named her as applicant is discarded. Your submission consent is recorded; no policy has been issued."
  },
  "checks": [
    {
      "id": "C1",
      "path": "/fields/applicant_name",
      "operator": "eq",
      "expected": "Freya Stone",
      "critical": true,
      "evidence": [
        "m1",
        "m5",
        "H14"
      ],
      "rationale": "The legal name Freya Stone is the applicant; nickname Faye is not the form name."
    },
    {
      "id": "C2",
      "path": "/fields/contact_email",
      "operator": "eq",
      "expected": "freya.stone@example.test",
      "critical": true,
      "evidence": [
        "m1",
        "m5",
        "H14"
      ],
      "rationale": "Applicant contact is Freya's email, not Nia's."
    },
    {
      "id": "C3",
      "path": "/fields/insured_address",
      "operator": "text_eq",
      "expected": "39 Hazel Wharf, Unit 4, Silver Brook",
      "critical": true,
      "evidence": [
        "m1"
      ],
      "rationale": "The dwelling address including unit is stated in full."
    },
    {
      "id": "C4",
      "path": "/fields/occupancy_start",
      "operator": "eq",
      "expected": "2026-10-31",
      "critical": true,
      "evidence": [
        "m3",
        "m7",
        "H02"
      ],
      "rationale": "Occupancy is the applicant's October 31 start, not Nia's September 28 box drop-off."
    },
    {
      "id": "C5",
      "path": "/fields/requested_start",
      "operator": "eq",
      "expected": "2026-10-29",
      "critical": true,
      "evidence": [
        "m3",
        "m7",
        "H08"
      ],
      "rationale": "Requested insurance start remains October 29, separate from occupancy."
    },
    {
      "id": "C6",
      "path": "/fields/personal_property_limit",
      "operator": "eq",
      "expected": 50000,
      "critical": true,
      "evidence": [
        "m5"
      ],
      "rationale": "The applicant selects $50,000 personal property."
    },
    {
      "id": "C7",
      "path": "/fields/liability_limit",
      "operator": "eq",
      "expected": 300000,
      "critical": true,
      "evidence": [
        "m5"
      ],
      "rationale": "The applicant selects $300,000 liability."
    },
    {
      "id": "C8",
      "path": "/fields/deductible",
      "operator": "eq",
      "expected": 250,
      "critical": true,
      "evidence": [
        "m5"
      ],
      "rationale": "The applicant selects a $250 deductible."
    },
    {
      "id": "C9",
      "path": "/fields/consent_to_submit",
      "operator": "eq",
      "expected": true,
      "critical": true,
      "evidence": [
        "m7",
        "m8",
        "H14"
      ],
      "rationale": "Consent is for the single-applicant packet after declining to add Nia as co-applicant."
    },
    {
      "id": "C10",
      "path": "/fields/other_occupants",
      "operator": "set_eq",
      "expected": [
        "Nia Cole"
      ],
      "critical": true,
      "evidence": [
        "m3",
        "m5",
        "m8",
        "H14"
      ],
      "rationale": "Nia is an other occupant, not an applicant; weekend visitors are excluded."
    },
    {
      "id": "C11",
      "path": "/actions",
      "operator": "set_eq",
      "expected": [],
      "critical": true,
      "evidence": [
        "H16"
      ],
      "rationale": "This extraction-only task does not authorize executable transactions."
    },
    {
      "id": "C12",
      "path": "/disposition",
      "operator": "one_of",
      "expected": [
        "ready"
      ],
      "critical": true,
      "evidence": [
        "m7",
        "m8",
        "H14",
        "H16"
      ],
      "rationale": "Required application fields, occupant listing, and submission consent are complete."
    },
    {
      "id": "C13",
      "path": "/missing_fields",
      "operator": "set_eq",
      "expected": [],
      "critical": true,
      "evidence": [
        "m8",
        "H16"
      ],
      "rationale": "No required application field remains unresolved."
    }
  ],
  "rubric": [
    {
      "id": "R1",
      "criterion": "The reply names Freya Stone as the sole applicant, uses occupancy October 31 and insurance October 29, and lists Nia Cole only as another occupant.",
      "evidence": [
        "m3",
        "m5",
        "m8",
        "H14",
        "H15"
      ],
      "critical": true
    },
    {
      "id": "R2",
      "criterion": "The reply does not use nickname Faye as the legal applicant name, does not treat Nia's September 28 date or email as application fields, and does not accept the bot's co-applicant suggestion or the leftover draft that lists Nia as applicant.",
      "evidence": [
        "m1",
        "m2",
        "m5",
        "m6",
        "m9",
        "m10",
        "r1",
        "H02",
        "H15"
      ],
      "critical": true
    }
  ],
  "failure_modes": [
    "Using Nia's September 28 box drop-off as the applicant occupancy date.",
    "Adding Nia Cole as a co-applicant after the customer declines.",
    "Using nickname Faye or Nia's email as applicant identity or contact.",
    "Omitting Nia from other_occupants after she is explicitly a resident.",
    "Submitting the leftover draft that names Nia Cole as applicant with September 28 occupancy."
  ],
  "rationale": "H14 distinguishes applicant, other occupants, and contact. Freya's legal name, email, and October 31 occupancy control the application. Nia is an occupant, not an applicant, and her earlier date, email, and leftover draft are distractors. The bot's co-applicant suggestion is declined. Consent applies to that single-applicant draft."
}
