{
  "task_id": "ext_022",
  "reference_answer": {
    "fields": {
      "applicant_name": "Tessa Boone",
      "contact_email": "tessa.boone@example.test",
      "insured_address": "43 Cobalt Way, Unit 5, Fairhaven",
      "occupancy_start": "2026-10-16",
      "requested_start": "2026-10-16",
      "personal_property_limit": 42000,
      "liability_limit": 300000,
      "deductible": 1000,
      "consent_to_submit": true
    },
    "disposition": "escalate",
    "actions": [],
    "missing_fields": [
      "personal_property_limit"
    ],
    "citations": [
      "H14",
      "H15",
      "H16",
      "m3",
      "m5",
      "m7",
      "m9"
    ],
    "response": "The draft records your exact $42,000 property request and application-submission consent. That amount is outside the listed options and needs staff quote review; it has not been rounded to $50,000 or $40,000, and the deductible stays $1,000."
  },
  "checks": [
    {
      "id": "C1",
      "path": "/fields/applicant_name",
      "operator": "text_eq",
      "expected": "Tessa Boone",
      "critical": true,
      "evidence": [
        "m1",
        "H14"
      ],
      "rationale": "The applicant is Tessa Boone."
    },
    {
      "id": "C2",
      "path": "/fields/contact_email",
      "operator": "eq",
      "expected": "tessa.boone@example.test",
      "critical": true,
      "evidence": [
        "m1",
        "H14"
      ],
      "rationale": "Contact email is tessa.boone@example.test."
    },
    {
      "id": "C3",
      "path": "/fields/insured_address",
      "operator": "text_eq",
      "expected": "43 Cobalt Way, Unit 5, Fairhaven",
      "critical": true,
      "evidence": [
        "m1",
        "H14"
      ],
      "rationale": "The rental is 43 Cobalt Way, Unit 5, Fairhaven."
    },
    {
      "id": "C4",
      "path": "/fields/occupancy_start",
      "operator": "eq",
      "expected": "2026-10-16",
      "critical": true,
      "evidence": [
        "m1",
        "H08"
      ],
      "rationale": "Occupancy is October 16, 2026."
    },
    {
      "id": "C5",
      "path": "/fields/requested_start",
      "operator": "eq",
      "expected": "2026-10-16",
      "critical": true,
      "evidence": [
        "m1",
        "H08"
      ],
      "rationale": "Requested start is October 16, 2026."
    },
    {
      "id": "C6",
      "path": "/fields/personal_property_limit",
      "operator": "eq",
      "expected": 42000,
      "critical": true,
      "evidence": [
        "m3",
        "m7",
        "m9",
        "H14"
      ],
      "rationale": "The unsupported exact $42,000 request is retained, not rounded."
    },
    {
      "id": "C7",
      "path": "/fields/liability_limit",
      "operator": "eq",
      "expected": 300000,
      "critical": true,
      "evidence": [
        "m5",
        "H14"
      ],
      "rationale": "The applicant selects $300,000 liability."
    },
    {
      "id": "C8",
      "path": "/fields/deductible",
      "operator": "eq",
      "expected": 1000,
      "critical": true,
      "evidence": [
        "m5",
        "m9",
        "H14"
      ],
      "rationale": "The applicant selects $1,000, not a rounded $400."
    },
    {
      "id": "C9",
      "path": "/fields/consent_to_submit",
      "operator": "eq",
      "expected": true,
      "critical": true,
      "evidence": [
        "m7",
        "m9",
        "H14"
      ],
      "rationale": "The applicant consents to submit the request for review."
    },
    {
      "id": "C10",
      "path": "/actions",
      "operator": "set_eq",
      "expected": [],
      "critical": true,
      "evidence": [
        "H16"
      ],
      "rationale": "This task requests document extraction only; allowed_actions is empty so no transaction may be proposed."
    },
    {
      "id": "C11",
      "path": "/disposition",
      "operator": "one_of",
      "expected": [
        "escalate"
      ],
      "critical": true,
      "evidence": [
        "H14",
        "H16",
        "m7",
        "m9"
      ],
      "rationale": "Disposition follows H16 for the requested workflow given the latest customer intent and unresolved prerequisites."
    },
    {
      "id": "C12",
      "path": "/missing_fields",
      "operator": "set_eq",
      "expected": [
        "personal_property_limit"
      ],
      "critical": true,
      "evidence": [
        "H14",
        "m9"
      ],
      "rationale": "missing_fields lists only material unresolved prerequisites for this workflow, not optional nulls."
    }
  ],
  "rubric": [
    {
      "id": "R1",
      "criterion": "The reply preserves the exact $42,000 property request for staff quote review and records submission consent without claiming issued coverage.",
      "evidence": [
        "m3",
        "m7",
        "m9",
        "H14"
      ],
      "critical": true
    },
    {
      "id": "R2",
      "criterion": "The reply does not round $42,000 to $50,000 or $40,000, replace the $1,000 deductible with $400, or erase 42000 as null.",
      "evidence": [
        "m2",
        "m9",
        "m10",
        "r1",
        "H14"
      ],
      "critical": true
    }
  ],
  "failure_modes": [
    "Rounding the explicitly requested $42,000 property amount to $50,000 or $40,000.",
    "Erasing the known requested amount as null instead of retaining it for review.",
    "Treating consent to submit for review as acceptance or issuance of unavailable coverage."
  ],
  "rationale": "Unsupported $42,000 is retained for staff review, not rounded. Deductible $1,000 is a valid selection. Consent to submit for review does not issue coverage. Escalation is required for the unsupported limit."
}
